date,doc_id,item,category,amount,price,discount
2025-03-24,DuZy78irGa9g43qn,Жаровня чугунная «Гардарика» 32 см,Посуда,2,3799,2
2025-03-24,DuZy78irGa9g43qn,"Кашпо из металла Selecta 13х9,5х12 см",Декор и интерьер,13,439,0
2025-03-24,DuZy78irGa9g43qn,Тарелка силиконовая,Посуда,7,799,3
2025-03-24,DuZy78irGa9g43qn,Корзина для белья Curver Knit 57 л,Хранение и порядок,6,3509,2
2025-03-24,DuZy78irGa9g43qn,Ваза для сервировки DOMEO 16x18 см,Посуда,13,1199,0
2025-03-24,DuZy78irGa9g43qn,Игрушка на ёлку Selecta Christmas «Балерина» 14 см,Новый год,5,149,3
