date,doc_id,item,category,amount,price,discount
2025-03-24,7Hh0ou6MBwQ9sadH,Коврик для ванной комнаты Selecta 40х60 см серого цвета с линиями,Текстиль,1,1099,3
2025-03-24,7Hh0ou6MBwQ9sadH,Разделитель для посуды Selecta 3 шт.,Посуда,6,289,2
2025-03-24,7Hh0ou6MBwQ9sadH,Сковорода чугунная «Камская посуда» 32 см с ручками,Посуда,3,2599,2
2025-03-24,7Hh0ou6MBwQ9sadH,Форма для торта регулируемая DOMEO 15-30 см,Посуда,1,635,2
2025-03-24,7Hh0ou6MBwQ9sadH,Мешок для стирки Selecta 16x18 см,Хозяйственные товары,2,289,1
