doc_id,item,category,amount,price,discount
HJltIDvvIHmITSfJ,Подставка под ложку DOMEO «Лаванда-2»,Посуда,13,329,0
HJltIDvvIHmITSfJ,Сушилка для белья напольная «Ника» 18 м,Хозяйственные товары,10,1679,2
HJltIDvvIHmITSfJ,Органайзер для мелочей Selecta 27х14 см,Хранение и порядок,5,1749,4
HJltIDvvIHmITSfJ,Набор для мытья пола Selecta,Хозяйственные товары,7,5289,5
HJltIDvvIHmITSfJ,Блюдо сервировочное DOMEO 20 см,Посуда,4,949,4
HJltIDvvIHmITSfJ,Набор столовых приборов TimA «Твист» 24 предмета,Посуда,10,10799,5
